{
  "model": { "name": "laya", "version": "0.0.0-example" },
  "plate_id": "plate-t7",
  "allergens": [
    {
      "allergen_unit_id": "peanut",
      "probability": 0.79,
      "chain": [
        { "step": 1, "event_id": "e-000123", "from_id": "bin-4", "to_id": "tool-knife-17", "t_ms": 183580, "action": "transfer.scoop", "allergen_unit_id": "peanut", "step_confidence": 0.91 },
        { "step": 2, "event_id": "e-000131", "from_id": "tool-knife-17", "to_id": "plate-t7", "t_ms": 186020, "action": "transfer.contact", "allergen_unit_id": "peanut", "step_confidence": 0.88 }
      ]
    }
  ],
  "latency_ms": 240
}
